{
  "schema_version": 1,
  "run_id": "fx-2-v2-run",
  "execution_mode": "service-batch",
  "queue_authoritative": false,
  "generated_utc": "2026-10-27T12:00:00Z",
  "services": [
    {
      "service": "ssh",
      "status": "done",
      "rc": 0
    },
    {
      "service": "smb",
      "status": "done",
      "rc": 0
    },
    {
      "service": "ldap",
      "status": "done",
      "rc": 0
    }
  ]
}
